name,ring,quadrant,isNew,description
C#,Adopt,languages-and-frameworks,FALSE,"C# (Си Шарп) является объектно-ориентированным языком программирования, разработанным компанией Microsoft. Он был представлен в 2000 году и включен в состав платформы .NET. C# был создан для упрощения процесса разработки приложений, особенно для платформы Windows.

Вот некоторые основные особенности C#:

Объектная ориентированность: C# является объектно-ориентированным языком, что означает, что он основан на идеях инкапсуляции, наследования и полиморфизма. Это позволяет разработчикам создавать более модульные и гибкие программы.
Символы: В C# символы имеют тип char, который может хранить один символ в юникоде.
Строки: Строки в C# представлены типом string, который является массивом символов юникода.
Переменные: В C#, переменные объявляются с использованием ключевого слова var, если тип переменной может быть определен из контекста. В противном случае, необходимо явно указать тип переменной.
Типы данных: C# поддерживает различные встроенные числовые типы данных, такие как целочисленные (int, uint), с плавающей точкой (float, double), а также булевы (bool)."
PHP,Assess,languages-and-frameworks,FALSE,"PHP (Hypertext Preprocessor) — это широко используемый открытый серверный скриптовый язык общего назначения, особенно популярный для веб-разработки и работы с базами данных. Он был разработан для обработки HTML-кода, написания сценариев на стороне сервера и генерации динамических веб-страниц.

PHP обладает рядом особенностей, которые делают его популярным выбором для многих веб-проектов:

– Простота: PHP имеет простой синтаксис, который легко освоить даже новичкам. Это делает его идеальным для начинающих веб-разработчиков.
– Открытый исходный код: PHP является открытым программным обеспечением и распространяется под лицензией PHP License. Это означает, что его можно использовать бесплатно и модифицировать по своему усмотрению.
– Богатая библиотека: PHP поставляется с большой коллекцией функций и библиотек, которые могут быть использованы для решения различных задач, таких как работа с базами данных, обработка форм, генерация PDF-файлов и многое другое.
– Кросс-платформенность: PHP работает на различных платформах, включая Windows, Linux и macOS. Это позволяет использовать его для создания веб-приложений, работающих на разных операционных системах."
JAVA,Adopt,languages-and-frameworks,FALSE,"JAVA — высокоуровневый язык программирования общего назначения, разработанный компанией Oracle Corporation. Он является статически типизированным, компилируемым языком с автоматическим управлением памятью, обладая при этом концепциями объектно-ориентированного программирования.

Язык Java был разработан в 1995 году Джеймсом Гослингом, и с тех пор он стал одним из самых популярных языков программирования в мире. Java используется для создания множества различных типов приложений, от простых веб-приложений до сложных корпоративных систем.

Одним из главных преимуществ Java является его кросс-платформенность. Это означает, что программы, написанные на Java, могут работать на разных типах устройств и операционных систем без необходимости их модификации. Это достигается благодаря тому, что Java-программы компилируются в байт-код, который затем выполняется виртуальной машиной Java (JVM).

Java также обладает богатой стандартной библиотекой, которая включает в себя различные классы и интерфейсы для работы с файлами, сетью, базами данных и другими ресурсами. Кроме того, существует множество сторонних библиотек, которые еще больше расширяют возможности языка.

Еще одной особенностью Java является его безопасность. Java-программы выполняются в “песочнице”, что предотвращает возможность выполнения вредоносного кода внутри программы."
Node.JS,Adopt,languages-and-frameworks,FALSE,"Node.js — это кросс-платформенная среда выполнения JavaScript, позволяющая выполнять JavaScript-код вне браузера. Node.js использует движок V8, который используется в Google Chrome, и позволяет использовать JavaScript для серверных приложений.

Node.js имеет несколько особенностей, которые делают его привлекательным для разработчиков:

– Высокая производительность: Node.js является однопоточным, что означает, что все операции ввода-вывода выполняются асинхронно. Это позволяет Node.js обрабатывать большое количество одновременных запросов без снижения производительности.
– Библиотеки и фреймворки: Node.js имеет большое количество библиотек и фреймворков, которые позволяют разработчикам быстро создавать приложения. Некоторые из наиболее популярных библиотек включают Express, Koa, Hapi и Sails.
– Интеграция с другими технологиями: Node.js легко интегрируется с другими технологиями, такими как MongoDB, Redis и PostgreSQL. Это позволяет создавать масштабируемые и отказоустойчивые приложения.
– Поддержка модулей: Node.js поддерживает модули, что позволяет разработчикам легко создавать модульные приложения."
Swift,Adopt,languages-and-frameworks,FALSE,"Swift — мультипарадигменный, компилируемый язык программирования, разработанный корпорацией Apple для iOS, macOS, watchOS, tvOS и Linux. Swift был представлен в июне 2014 года на конференции WWDC.

Swift является современным языком программирования с поддержкой многих передовых возможностей, таких как closures, generics, tuples, optionals, pattern matching, immutability and operator overloading.

Одной из ключевых особенностей Swift является его производительность. Swift использует компилятор Just-in-Time (JIT) для оптимизации кода во время выполнения, что позволяет получить высокую производительность при минимальном объеме кода.

Кроме того, Swift имеет простой и понятный синтаксис, который облегчает изучение языка для начинающих программистов."
Kotlin,Adopt,languages-and-frameworks,FALSE,"Kotlin — это современный статически типизированный язык программирования для создания различных приложений, который разрабатывается и поддерживается компанией JetBrains. Язык был создан с целью сделать разработку более удобной и продуктивной, сохранив при этом совместимость с библиотеками и существующим кодом на Java.

Основные особенности Kotlin:

– Простота и лаконичность: Kotlin предлагает более краткий и понятный синтаксис по сравнению с Java, что делает код более читаемым и упрощает его написание.
– Статическая типизация: Kotlin гарантирует, что типы переменных будут определены на этапе компиляции, что повышает безопасность и надежность кода.
– Функции высшего порядка: В Kotlin можно передавать функции как аргументы другим функциям или возвращать их как результат других функций, что делает код более гибким и расширяемым.
– Лямбда-выражения и операторы функций: Kotlin предоставляет удобные средства для работы с функциями, включая лямбда-выражения, функции-расширения и оператор функции.
– Null-безопасность: Kotlin позволяет избежать ошибок, связанных с нулевыми указателями, благодаря строгому контролю за возможным отсутствием значений.
– Интерфейсы и реализации: Kotlin поддерживает интерфейсы и реализации, что позволяет создавать гибкие и модульные системы."
Angular,Adopt,Platforms,FALSE,"Angular — это популярная платформа для разработки веб-приложений на основе архитектуры Model-View-Controller (MVC). Она разработана и поддерживается командой Google Angular Team и используется для создания интерактивных, быстрых и безопасных веб-приложений.

Angular имеет ряд особенностей, которые делают его востребованным среди разработчиков:

– MVC-архитектура: Angular разделяет приложение на три основных компонента: модель (Model), представление (View) и контроллер (Controller). Это позволяет разработчикам сосредоточиться на конкретной задаче и упрощает процесс разработки.
– Двухсторонняя привязка данных (Data-binding): Angular автоматически синхронизирует данные между моделью и представлением, что упрощает разработку пользовательского интерфейса и уменьшает количество ошибок.
– Модульность: Angular позволяет разбивать приложение на модули, каждый из которых может быть разработан отдельно и интегрирован в приложение без влияния на другие модули. Это упрощает масштабирование и поддержку приложения.
– Тестирование: Angular имеет встроенную поддержку тестирования, что облегчает процесс тестирования и отладки приложений.
– Интеграция с Angular CLI: Angular CLI — это инструмент командной строки, который упрощает процесс создания новых проектов, управление зависимостями и сборкой приложений."
JS,Adopt,languages-and-frameworks,FALSE,"JavaScript — это высокоуровневый, интерпретируемый, слабо типизированный язык программирования. Разработан и внедрен фирмой Netscape в браузер Navigator 2.0 в 1996 году.

Синтаксис языка подобен синтаксису Java, однако JavaScript проще и компактнее.

На данный момент JavaScript является самым популярным языком программирования в Интернете. Он используется для создания сложных интерактивных веб-сайтов, мобильных приложений и даже для программирования микроконтроллеров.

Одна из главных особенностей JavaScript — его кроссбраузерность. Программы на JavaScript могут выполняться в любом современном браузере, что делает его идеальным выбором для веб-разработки.

Другой важной особенностью JavaScript является его асинхронность. Это означает, что JavaScript может выполнять несколько операций одновременно, что делает его очень эффективным для создания интерактивных веб-приложений."
1С,Adopt,languages-and-frameworks,FALSE,"1C – это не только язык программирования, но и платформа для разработки бизнес-приложений. Она была создана в России в 1991 году и с тех пор стала одним из самых популярных инструментов для автоматизации бизнеса.

Платформа 1C используется для разработки различных приложений, таких как программы учета, управления предприятием, CRM-системы и другие. Она имеет открытый исходный код, что позволяет программистам создавать свои собственные приложения на ее основе.

Особенностью языка 1C является его простота и удобство для пользователя. Он имеет простой и интуитивно понятный интерфейс, который позволяет даже неопытным пользователям быстро освоиться в программе. Кроме того, 1C имеет широкий набор инструментов для работы с данными, что делает его универсальным решением для автоматизации бизнес-процессов."
Ionic,Hold,Platforms,FALSE,"Ionic — это платформа для создания мобильных приложений с использованием web-технологий (HTML, CSS, JavaScript). Она была разработана компанией Drifty и основана на фреймворке Angular.

Ionic позволяет создавать нативные Android и iOS приложения с использованием HTML, CSS и JavaScript. Это означает, что вы можете использовать те же инструменты и технологии, которые вы уже знаете, чтобы создать приложение, которое будет работать на мобильных устройствах.

Особенности Ionic:

– Поддержка нескольких платформ: Ionic позволяет создавать приложения для Android, iOS и Windows.
– Быстрый старт: Ionic имеет простой и быстрый процесс создания нового проекта, который включает в себя все необходимые файлы и настройки.
– Нативный внешний вид: Ionic использует компоненты Material Design от Google, что обеспечивает нативный внешний вид приложений на всех платформах.
– Гибкость: Ionic позволяет вам создавать приложения с любой сложностью, от простых одностраничных приложений до сложных многостраничных приложений.
– Открытый исходный код: Ionic является open-source проектом, что означает, что вы можете свободно использовать его в своих проектах."
PhoneGap,Hold,Platforms,FALSE,"PhoneGap — это фреймворк для создания гибридных мобильных приложений, основанный на Web технологиях. Он позволяет использовать HTML, CSS, и JavaScript для создания нативных приложений для iOS, Android и других платформ.

PhoneGap был создан компанией Nitobi в 2009 году, а затем был приобретен Adobe Systems в 2011 году. В 2015 году компания Adobe передала PhoneGap в открытый доступ, и теперь он является проектом с открытым исходным кодом, поддерживаемым сообществом разработчиков.

PhoneGap использует технологию Cordova для создания приложений. Эта технология позволяет разработчикам использовать нативные API и компоненты платформы, на которой работает приложение, без необходимости писать нативный код.

Основными преимуществами PhoneGap являются:

– Кросс-платформенность — PhoneGap позволяет создавать приложения, которые работают на разных платформах, таких как iOS, Android, Windows Phone и других.
– Простота разработки — PhoneGap использует HTML, CSS и JavaScript, что делает процесс разработки более простым и понятным для разработчиков, знакомых с этими языками.
– Быстрая разработка — благодаря использованию готовых компонентов и нативному API, разработка приложений с помощью PhoneGap занимает меньше времени, чем разработка нативных приложений."
Django,Adopt,Platforms,FALSE,"Django - это высокоуровневая веб-фреймворк, написанная на языке Python, которая используется для быстрого создания веб-приложений и веб-сервисов. Django был создан для того, чтобы облегчить процесс разработки и сделать его более продуктивным, предоставляя разработчикам инструменты, необходимые для создания масштабируемых и надежных веб-приложений. Одной из особенностей Django является его ORM (Object Relational Mapper), который позволяет разработчикам работать с базами данных на более высоком уровне абстракции, не заботясь о деталях SQL. Кроме того, Django имеет встроенный механизм аутентификации и авторизации, что упрощает создание систем управления доступом."
Spring Boot,Adopt,Platforms,FALSE,"Spring Boot - это фреймворк с открытым исходным кодом для создания микросервисов и веб-приложений, написанный на языке программирования Java. Spring Boot упрощает процесс разработки, делая его более быстрым и эффективным. Одной из ключевых особенностей Spring Boot является его способность автоматически конфигурировать приложение, что позволяет сосредоточиться на разработке логики приложения, а не на настройке среды. Spring Boot также предоставляет инструменты для работы с RESTful API, базами данных, очередями сообщений и другими сервисами."
Lumen (laravel),Hold,Platforms,FALSE,"Lumen - это микрофреймворк на основе Symfony, предназначенный для быстрой разработки RESTful API. Он был создан для тех, кто хочет получить скорость и простоту, характерные для микрофреймворков, но при этом иметь доступ к богатым возможностям, которые предлагает Symfony. Lumen также известен своей производительностью и возможностью масштабирования. Он идеально подходит для создания API, работающих со сложными данными или в условиях большой нагрузки."
