name,ring,quadrant,isNew,description
Vue.js,Assess,languages-and-frameworks,FALSE,"Vue.js - это прогрессивный фреймворк для создания пользовательских интерфейсов. Он был создан командой разработчиков из компании Google и представляет собой JavaScript-библиотеку для построения интерактивных пользовательских интерфейсов, используя модель представления (view), вычисление (computation) и представление (view update).

Vue.js имеет ряд преимуществ перед другими фреймворками, такими как Angular и React. Во-первых, он очень прост в изучении и использовании, что делает его идеальным для начинающих разработчиков. Во-вторых, он имеет малый размер и высокую производительность, что делает его идеальным выбором для создания быстрых и эффективных приложений. В-третьих, Vue.js имеет открытый исходный код и бесплатную лицензию, что позволяет использовать его без ограничений.

Ответь иначе
Хороший ответ
Плохой ответ
Справка

"
Lockbox,Trial,Techniques,NEW,"LockBox - это сервис для хранения и шифрования данных, который позволяет пользователям безопасно хранить свои данные в облаке. Он использует технологию шифрования дисков (Disk Encryption), чтобы обеспечить защиту данных от несанкционированного доступа.

LockBox предоставляет пользователям возможность создавать зашифрованные контейнеры, которые могут быть открыты только с использованием уникального ключа шифрования. Этот ключ может быть защищен с помощью пароля или аппаратного ключа безопасности, такого как USB-токен или смарт-карта.

Сервис также предоставляет возможность совместного использования контейнеров с другими пользователями, что позволяет работать над проектами вместе с коллегами. LockBox доступен на различных платформах, включая Windows, macOS и Linux, что делает его удобным для использования в различных условиях."
ChatGPT,Assess,Tools,NEW,"ChatGPT (Generative Pretrained Transformer 3) - это мощная языковая модель, разработанная OpenAI, которая может генерировать человекоподобные текстовые ответы на различные запросы. Она основана на архитектуре трансформера и предварительно обучается на большом объеме текстовых данных, что позволяет ей обрабатывать и анализировать естественный язык с высокой точностью.

Основные возможности ChatGPT включают в себя:

Генерация текста: ChatGPT может создавать осмысленные и связные тексты на основе заданного запроса. Например, она может написать эссе на заданную тему, создать сценарий для видеоигры или даже написать стихотворение.
Ответ на вопросы: ChatGPT способна отвечать на разнообразные вопросы, опираясь на свой обучающий набор данных. Это делает ее идеальным инструментом для создания чат-ботов, которые могут общаться с пользователями на различные темы.
Обработка естественного языка (NLP): ChatGPT также можно использовать для выполнения задач, связанных с обработкой естественного языка, таких как анализ тональности текста, классификация документов или извлечение информации.
Обучение и адаптация: ChatGPT можно адаптировать для решения конкретных задач путем дополнительного обучения на специализированных наборах данных. Это позволяет использовать ее в различных областях, таких как маркетинг, финансы, медицина и многих других."
S3 File Service,Adopt,Techniques,FALSE,"S3 (Simple Storage Service) - это сервис хранения объектов, предлагаемый Amazon Web Services (AWS). Он обеспечивает масштабируемое и надежное хранение данных в облаке. S3 предлагает три типа объектов:

– Файлы: S3 поддерживает различные типы файлов, такие как текстовые файлы, изображения, видео и другие.
– Объекты списка: Они используются для хранения списка файлов в каталоге.
– Объекты корзины: Они используются для временного хранения удаленных файлов.

S3 предлагает высокую доступность и масштабируемость, а также низкие цены. Он также обеспечивает шифрование данных на уровне объекта и на уровне сервера."
Azure AD SSO,Adopt,Techniques,NEW,"Azure Active Directory (Azure AD) – это комплексная служба управления идентификацией и доступом, предлагаемая Microsoft. Она обеспечивает единый вход для пользователей, чтобы они могли безопасно получить доступ к приложениям и ресурсам своей организации. Azure AD также позволяет организациям централизованно и последовательно управлять своими идентификационными данными, контролем доступа и процессами предоставления доступа. Кроме того, Azure AD поддерживает широкий спектр функций, таких как многофакторная аутентификация, условный доступ, прокси-сервер приложений и передовые средства безопасности."
NiFi,Trial,Tools,NEW,"NiFi — это ETL инструмент. Дословно расшифровывается как «Extract, Transform, Load» и переводится на русский язык как «вытащить, преобразовать, загрузить». Обычно такие инструменты используются для сбора данных из разных источников и загрузки в какое-то единое место, например, в Data Lake или просто какую-то очень большую базу данных. Место загрузки зависит от архитектуры. Главное — понять предназначение этих инструментов."
