name,ring,quadrant,isNew,description
.NET Framework,Hold,Platforms,FALSE,".NET Framework - это платформа разработки программного обеспечения, разработанная компанией Microsoft. Она представляет собой набор библиотек и инструментов, которые позволяют разработчикам создавать различные типы приложений, такие как веб-приложения, мобильные приложения, десктопные приложения и многое другое. .NET Framework также включает в себя среду выполнения, которая позволяет запускать созданные приложения на различных операционных системах, таких как Windows. Одной из главных особенностей .NET Framework является его гибкость и универсальность, что позволяет разработчикам создавать приложения с высокой производительностью и надежностью."
.NET 6,Hold,Platforms,FALSE,".NET 6 - это последняя версия платформы .NET, разработанная компанией Microsoft. Она содержит множество улучшений и новых возможностей по сравнению с предыдущими версиями. Одним из главных нововведений в .NET 6 является поддержка кросс-платформенной разработки. Теперь разработчики могут создавать приложения, которые будут работать на различных платформах, таких как Windows, MacOS и Linux. Также в .NET 6 появилась новая система управления пакетами, которая упрощает процесс установки и обновления пакетов. Кроме того, была улучшена производительность и безопасность платформы."
.NET 7,Adopt,Platforms,FALSE,".NET 7 - это следующая версия платформы .NET, которая находится в разработке. Она будет содержать еще больше улучшений и новых возможностей, которые сделают разработку еще более удобной и эффективной. Некоторые из ожидаемых нововведений включают улучшенную производительность, новые инструменты для разработки игр, улучшенную поддержку машинного обучения и многое другое."
WinUI 3,Trial,Platforms,NEW,"WinUI 3 - это современная платформа пользовательского интерфейса, разработанная Microsoft для создания привлекательных и функциональных приложений универсальной платформы Windows (UWP). WinUI 3 предоставляет разработчикам набор современных пользовательских элементов управления, стилей и шаблонов, которые можно использовать для создания красивых и удобных приложений. WinUI 3 также упрощает разработку приложений за счет использования современных инструментов и технологий, таких как XAML, C# и .NET. Это позволяет разработчикам быстро создавать многофункциональные приложения с минимальными усилиями."
UNO,Trial,Platforms,NEW,"Uno Platform - это кросс-платформенная мобильная разработка платформа, основанная на .NET Core. Она позволяет создавать универсальные приложения, которые могут работать на различных устройствах, включая смартфоны, планшеты и компьютеры. Платформа использует Xamarin для разработки приложений, что позволяет использовать C# в качестве основного языка программирования. Uno также поддерживает разработку на других языках, таких как Java и Swift. Платформа имеет открытый исходный код и доступна для использования бесплатно."
ASP NET.CORE,Adopt,Platforms,FALSE,"ASP.NET Core - это бесплатная кросс-платформенная платформа с открытым исходным кодом веб-приложений и служб, разработанная и поддерживаемая Microsoft. ASP.NET Core предлагает множество функций, которые делают его идеальным для создания современных веб-приложений и сервисов. Некоторые из ключевых функций ASP.NET Core включают поддержку модульности, возможность использования нескольких сред выполнения, поддержку современных веб-технологий, таких как HTML5, CSS и JavaScript, и многое другое. Кроме того, ASP.NET Core имеет обширную документацию и сообщество, которые помогут вам в разработке вашего приложения."
MSSQL,Assess,Tools,FALSE,"MSSQL (Microsoft SQL Server) - это система управления реляционными базами данных (РСУБД), разработанная корпорацией Microsoft. MSSQL Server является одним из наиболее популярных продуктов в своем классе и используется во многих организациях для хранения и обработки данных.

MSSQL Server предоставляет множество функций и возможностей для работы с базами данных, включая поддержку различных типов данных, индексов, транзакций и многопользовательского доступа. Он также имеет широкий спектр инструментов и утилит для администрирования и мониторинга баз данных, что делает его удобным для использования в корпоративных средах."
PostgreSQL,Adopt,Tools,FALSE,"PostgreSQL - это объектно-реляционная система управления базами данных с открытым исходным кодом. Она была разработана в университете Беркли, Калифорния, и впервые выпущена в 1996 году. PostgreSQL является одним из самых популярных решений для управления базами данных и используется многими компаниями и организациями по всему миру.

Одной из ключевых особенностей PostgreSQL является его поддержка объектно-ориентированных возможностей, таких как наследование, переопределение методов и поддержка полиморфизма. Это позволяет разработчикам создавать более гибкие и расширяемые приложения. Кроме того, PostgreSQL имеет мощную систему типов данных, которая включает в себя такие типы, как массивы, строки переменной длины, геометрические типы и другие.

PostgreSQL также предлагает широкий спектр функций для работы с данными, включая индексы, транзакции, управление доступом и многое другое. Он поддерживает множество языков программирования, включая Python, Java, JavaScript и другие, что делает его доступным для широкого круга разработчиков."
SQLite,Hold,Tools,FALSE,"SQLite - это компактная, быстрая и открытая СУБД, которая позволяет создавать и использовать базы данных прямо в вашем приложении. SQLite не требует сервера, поэтому ваше приложение может работать даже без подключения к интернету.

SQLite использует файлы на диске для хранения данных, что позволяет быстро загружать и сохранять данные. SQLite также поддерживает транзакции, что гарантирует сохранность данных даже в случае сбоя приложения.

Одним из преимуществ SQLite является то, что она не требует установки дополнительных компонентов на компьютер пользователя. Это делает SQLite идеальным выбором для небольших приложений, которые не требуют сложной базы данных."
MySql,Adopt,Tools,FALSE,"MySQL - это система управления базами данных (СУБД), которая используется для хранения и управления данными в базах данных. Она разработана компанией Oracle и является одной из наиболее популярных СУБД в мире.

MySQL используется для хранения информации в Интернете, а также для создания баз данных в локальных сетях и на серверах. Она поддерживает различные типы данных, такие как строки, числа, даты и время, а также позволяет создавать индексы и триггеры для обеспечения безопасности и целостности данных.

MySQL имеет открытый исходный код, что означает, что его можно использовать бесплатно для любых целей. Существует множество инструментов и приложений, которые позволяют работать с MySQL, включая веб-интерфейсы, графические утилиты и библиотеки для различных языков программирования."
MariaDB,Hold,Tools,FALSE,"MariaDB - это открытое программное обеспечение, являющееся ответвлением от исходного кода MySQL. Оно было создано для обеспечения совместимости с MySQL и обеспечения лучшей производительности и стабильности.

MariaDB была создана сообществом MySQL и поддерживается компанией MariaDB Corporation. Она является одной из самых популярных баз данных в мире и используется в различных отраслях, включая веб-разработку, электронную коммерцию и научные исследования.

Основные преимущества MariaDB включают высокую производительность, надежность, масштабируемость и совместимость с MySQL. Она также предлагает множество дополнительных функций, таких как репликация, шифрование и оптимизация запросов, которые могут улучшить производительность вашего приложения."
Redis,Adopt,Tools,FALSE,"Redis - это open-source система управления ключами-значениями, разработанная в Университете ИТМО в Санкт-Петербурге. Она была создана как замена memcached, но со временем превратилась в более универсальное решение для хранения данных. Redis используется для кэширования данных, очередей сообщений, сохранения состояния сессий и многого другого. Одной из основных особенностей Redis является его производительность - он может обрабатывать миллионы запросов в секунду. Кроме того, Redis поддерживает различные типы данных, включая строки, списки, наборы и хеши. Это делает его идеальным решением для многих задач, связанных с обработкой и хранением данных."
Docker,Adopt,Tools,FALSE,"Docker - это платформа для разработки, доставки и развертывания приложений в контейнерах. Она позволяет упаковывать приложения со всеми зависимостями и запускать их на любой операционной системе, поддерживающей Docker. Docker также предоставляет инструменты для управления контейнерами, такие как Docker Compose, Docker Swarm и Docker Machine."
Kafka,Adopt,Tools,FALSE,"Kafka - это распределенная система обработки и хранения событий в режиме реального времени. Она разработана и поддерживается компанией Confluent. Kafka используется для обработки больших объемов данных, таких как данные социальных сетей, финансовые данные и т.д. Она позволяет хранить данные в течение длительного времени и обрабатывать их в пакетном режиме. Kafka также может использоваться для создания систем потоковой аналитики и машинного обучения."
ELK,Adopt,Tools,FALSE,"ELK Stack - это набор open-source инструментов с открытым исходным кодом, которые используются для сбора, обработки и анализа лог-файлов. Он состоит из трех компонентов: Elasticsearch, Logstash и Kibana. Elasticsearch используется для индексирования и поиска логов, Logstash - для их обработки и отправки в Elasticsearch, а Kibana - для визуализации и анализа данных. ELK Stack позволяет анализировать большие объемы логов и выявлять в них различные паттерны и аномалии."
Seq,Trial,Tools,FALSE,"Seq - это веб-приложение для логирования, которое позволяет отслеживать и анализировать логи вашего приложения. Оно имеет простой и понятный интерфейс, который позволяет быстро находить нужную информацию. Seq также имеет интеграцию с различными системами логирования, такими как Logstash, Elasticsearch и Kibana, что позволяет получать более подробную информацию о логах."
1С: Управление торговлей 11,Adopt,Platforms,FALSE,"1C:Управление торговлей 11 - это комплексное решение для автоматизации управления предприятием в сфере торговли. Оно позволяет автоматизировать такие процессы, как управление отношениями с клиентами, управление запасами, управление заказами, управление продажами и многое другое. Система 1C:УТ 11 также включает в себя функции для анализа и оптимизации бизнес-процессов, что помогает предприятиям повышать эффективность своей работы."
1С: MDM,Trial,Platforms,FALSE,"1C:MDM (Master Data Management) - это решение для управления основными данными, которое помогает организациям управлять и стандартизировать свои основные данные, такие как клиенты, продукты и поставщики. 1C: MDM позволяет организациям централизованно управлять своими основными данными и обеспечивает их качество и согласованность."
1С:УХ,Trial,Platforms,FALSE,"1C:УХ (Управление холдингом) - это комплексная система для автоматизации управления холдингами и группами компаний. Она позволяет управлять финансами, ресурсами, проектами и рисками в рамках всего холдинга. 1C:УХ также предоставляет инструменты для анализа эффективности работы холдинга и принятия стратегических решений."
1С:ЗУП,Adopt,Platforms,FALSE,"1C:ЗУП (Зарплата и управление персоналом) - это программа для автоматизации расчета заработной платы, управления персоналом и кадрового учета. Она позволяет организациям автоматизировать процессы начисления зарплаты, управления отпусками, ведения штатного расписания и других кадровых задач. 1C:ЗУП также предоставляет инструменты для анализа данных и отчетности по персоналу."
1С: DMS,Adopt,Platforms,FALSE,"1C:DMS (Документооборот и мобильное рабочее место) - это программный продукт, предназначенный для автоматизации документооборота и управления бизнес-процессами в организации. Он позволяет создавать, редактировать и хранить документы, а также управлять ими. DMS также предоставляет возможность работы с документами на мобильных устройствах."
1C: Управление рег. заданиями DMS,Trial,Platforms,FALSE,"1C:DMS (Документооборот и мобильное рабочее место) - это программный продукт, предназначенный для автоматизации документооборота и управления бизнес-процессами в организации. Он позволяет создавать, редактировать и хранить документы, а также управлять ими. DMS также предоставляет возможность работы с документами на мобильных устройствах."
1C: Консолидация,Hold,Platforms,FALSE,"1C:Консолидация - это программное решение, предназначенное для автоматизации процесса консолидации финансовой отчетности. Оно помогает компаниям собирать данные из различных источников, обрабатывать их и формировать консолидированную финансовую отчетность в соответствии с международными стандартами. 1C:Консолидация также позволяет анализировать данные и выявлять тенденции в финансовом состоянии компании."
1С: ERP 2.5,Assess,Platforms,FALSE,"1C:ERP (Enterprise Resource Planning) - это комплексное программное решение, которое позволяет автоматизировать управление предприятием. Оно включает в себя модули для управления финансами, закупками, продажами, производством, складом, персоналом и другими аспектами деятельности предприятия. 1C:ERP помогает оптимизировать бизнес-процессы, повышать эффективность работы и снижать затраты."
1С: ERP 2.4,Hold,Platforms,FALSE,"1C:ERP (Enterprise Resource Planning) - это комплексное программное решение, которое позволяет автоматизировать управление предприятием. Оно включает в себя модули для управления финансами, закупками, продажами, производством, складом, персоналом и другими аспектами деятельности предприятия. 1C:ERP помогает оптимизировать бизнес-процессы, повышать эффективность работы и снижать затраты."
1С: УПП,Hold,Platforms,FALSE,"1С:Управление производственным предприятием (1С:УПП) - это конфигурация системы программ 1С:Предприятие, предназначенная для автоматизации управления производственным предприятием. Она включает в себя функционал для управления производством, закупками, сбытом, складом и другими аспектами деятельности предприятия.

1С:УПП позволяет автоматизировать различные бизнес-процессы на предприятии, такие как планирование производства, управление качеством продукции, учет затрат и калькуляция себестоимости, управление персоналом и расчет заработной платы.

Кроме того, 1С:УПП имеет встроенный механизм интеграции с другими системами, такими как системы планирования ресурсов предприятия (ERP), системы управления взаимоотношениями с клиентами (CRM), системы управления цепочками поставок (SCM) и другие. Это позволяет предприятиям использовать 1С:УПП как основу для построения комплексной информационной системы.

Ответь иначе
Хороший ответ
Плохой ответ
Справка

"
